[
  {
    "id": "person:dinh-bo-linh",
    "type": "person",
    "names": {
      "zh": "丁部領",
      "vi": "Đinh Bộ Lĩnh"
    },
    "aliases": {
      "zh": [
        "部領",
        "先皇帝"
      ],
      "vi": [
        "Bộ Lĩnh",
        "Tiên Hoàng",
        "Tiên Hoàng Đế"
      ]
    }
  },
  {
    "id": "person:dinh-cong-tru",
    "type": "person",
    "names": {
      "zh": "丁公著",
      "vi": "Đinh Công Trứ"
    },
    "aliases": {
      "zh": [],
      "vi": []
    }
  },
  {
    "id": "person:duong-dinh-nghe",
    "type": "person",
    "names": {
      "zh": "楊廷藝",
      "vi": "Dương Đình Nghệ"
    },
    "aliases": {
      "zh": [],
      "vi": [
        "Đình Nghệ"
      ]
    }
  },
  {
    "id": "person:ngo-xuong-xi",
    "type": "person",
    "names": {
      "zh": "吳昌熾",
      "vi": "Ngô Xương Xí"
    },
    "aliases": {
      "zh": [],
      "vi": []
    }
  },
  {
    "id": "person:ngo-nhat-khanh",
    "type": "person",
    "names": {
      "zh": "吳日慶",
      "vi": "Ngô Nhật Khánh"
    },
    "aliases": {
      "zh": [],
      "vi": []
    }
  },
  {
    "id": "person:kieu-tam-che",
    "type": "person",
    "names": {
      "zh": "矯三制",
      "vi": "Kiểu Tam Chế"
    },
    "aliases": {
      "zh": [],
      "vi": []
    }
  },
  {
    "id": "person:nguyen-thai-binh",
    "type": "person",
    "names": {
      "zh": "阮太平",
      "vi": "Nguyễn Thái Bình"
    },
    "aliases": {
      "zh": [],
      "vi": []
    }
  },
  {
    "id": "person:do-canh-thac",
    "type": "person",
    "names": {
      "zh": "杜景碩",
      "vi": "Đỗ Cảnh Thạc"
    },
    "aliases": {
      "zh": [],
      "vi": []
    }
  },
  {
    "id": "person:nguyen-lenh-cong",
    "type": "person",
    "names": {
      "zh": "阮令公",
      "vi": "Nguyễn Lệnh Công"
    },
    "aliases": {
      "zh": [],
      "vi": [
        "Nguyễn Hữu Công"
      ]
    }
  },
  {
    "id": "person:lu-ta-duong",
    "type": "person",
    "names": {
      "zh": "吕佐",
      "vi": "Lữ Tá Đường"
    },
    "aliases": {
      "zh": [],
      "vi": []
    }
  },
  {
    "id": "person:nguyen-thu-tiep",
    "type": "person",
    "names": {
      "zh": "阮守㨗",
      "vi": "Nguyễn Thủ Tiệp"
    },
    "aliases": {
      "zh": [],
      "vi": []
    }
  },
  {
    "id": "person:ly-lang-cong",
    "type": "person",
    "names": {
      "zh": "李郎公",
      "vi": "Lý Lãng Công"
    },
    "aliases": {
      "zh": [],
      "vi": [
        "Lý Lãng Công"
      ]
    }
  },
  {
    "id": "person:kieu-lenh-cong",
    "type": "person",
    "names": {
      "zh": "矯令公",
      "vi": "Kiểu Lệnh Công"
    },
    "aliases": {
      "zh": [],
      "vi": []
    }
  },
  {
    "id": "person:pham-phong-at",
    "type": "person",
    "names": {
      "zh": "范防遏",
      "vi": "Phạm Phòng Át"
    },
    "aliases": {
      "zh": [],
      "vi": []
    }
  },
  {
    "id": "person:tran-minh-cong",
    "type": "person",
    "names": {
      "zh": "陳公",
      "vi": "Trần Minh Công"
    },
    "aliases": {
      "zh": [],
      "vi": []
    }
  },
  {
    "id": "person:le-van-huu",
    "type": "person",
    "names": {
      "zh": "黎文休",
      "vi": "Lê Văn Hưu"
    },
    "aliases": {
      "zh": [],
      "vi": []
    }
  },
  {
    "id": "person:dinh-lien",
    "type": "person",
    "names": {
      "zh": "丁璉",
      "vi": "Đinh Liễn"
    },
    "aliases": {
      "zh": [
        "璉"
      ],
      "vi": [
        "Liễn",
        "Nam Việt Vương Liễn"
      ]
    },
    "variants": [
      {
        "lang": "vi",
        "surface": "Nam Việt Vương Liệt",
        "kind": "suspected_textual_error",
        "status": "review",
        "evidence": "Chinese parallel has 璉; surrounding Vietnamese uses Liễn."
      }
    ]
  },
  {
    "id": "person:ly-nam-de",
    "type": "person",
    "names": {
      "zh": "李南帝",
      "vi": "Lý Nam Đế"
    },
    "aliases": {
      "zh": [],
      "vi": [
        "Lý Nam Đế"
      ]
    }
  },
  {
    "id": "person:phan-my",
    "type": "person",
    "names": {
      "zh": "潘美",
      "vi": "Phan Mỹ"
    },
    "aliases": {
      "zh": [],
      "vi": []
    }
  },
  {
    "id": "person:luu-xuong",
    "type": "person",
    "names": {
      "zh": "劉鋹",
      "vi": "Lưu Xưởng"
    },
    "aliases": {
      "zh": [],
      "vi": []
    }
  },
  {
    "id": "person:nguyen-bac",
    "type": "person",
    "names": {
      "zh": "阮匐",
      "vi": "Nguyễn Bặc"
    },
    "aliases": {
      "zh": [],
      "vi": []
    }
  },
  {
    "id": "person:luu-co",
    "type": "person",
    "names": {
      "zh": "劉基",
      "vi": "Lưu Cơ"
    },
    "aliases": {
      "zh": [],
      "vi": [
        "Lưu cơ"
      ]
    }
  },
  {
    "id": "person:le-hoan",
    "type": "person",
    "names": {
      "zh": "黎桓",
      "vi": "Lê Hoàn"
    },
    "aliases": {
      "zh": [],
      "vi": []
    }
  },
  {
    "id": "person:ngo-chan-luu",
    "type": "person",
    "names": {
      "zh": "吳真流",
      "vi": "Ngô Chân Lưu"
    },
    "aliases": {
      "zh": [],
      "vi": []
    }
  },
  {
    "id": "person:truong-ma-ni",
    "type": "person",
    "names": {
      "zh": "張麻尼",
      "vi": "Trương Ma Ni"
    },
    "aliases": {
      "zh": [],
      "vi": []
    }
  },
  {
    "id": "person:dang-huyen-quang",
    "type": "person",
    "names": {
      "zh": "鄧玄光",
      "vi": "Đặng Huyền Quang"
    },
    "aliases": {
      "zh": [],
      "vi": []
    }
  },
  {
    "id": "person:tran-thang",
    "type": "person",
    "names": {
      "zh": "陳升",
      "vi": "Trần Thăng"
    },
    "aliases": {
      "zh": [],
      "vi": [
        "Trần Thăng Minh"
      ]
    }
  },
  {
    "id": "person:trinh-tu",
    "type": "person",
    "names": {
      "zh": "鄭琇",
      "vi": "Trịnh Tú"
    },
    "aliases": {
      "zh": [],
      "vi": []
    }
  },
  {
    "id": "person:cao-bao-tu",
    "type": "person",
    "names": {
      "zh": "高保緒",
      "vi": "Cao Bảo Tự"
    },
    "aliases": {
      "zh": [],
      "vi": []
    }
  },
  {
    "id": "person:vuong-ngan-phu",
    "type": "person",
    "names": {
      "zh": "王彦符",
      "vi": "Vương Ngạn Phù"
    },
    "aliases": {
      "zh": [],
      "vi": []
    }
  },
  {
    "id": "person:tran-nguyen-thai",
    "type": "person",
    "names": {
      "zh": "陳元泰",
      "vi": "Trần Nguyên Thái"
    },
    "aliases": {
      "zh": [],
      "vi": []
    }
  },
  {
    "id": "person:dinh-hang-lang",
    "type": "person",
    "names": {
      "zh": "項郎",
      "vi": "Hạng Lang"
    },
    "aliases": {
      "zh": [],
      "vi": []
    }
  },
  {
    "id": "person:do-thich",
    "type": "person",
    "names": {
      "zh": "杜釋",
      "vi": "Đỗ Thích"
    },
    "aliases": {
      "zh": [],
      "vi": []
    }
  },
  {
    "id": "person:dinh-toan",
    "type": "person",
    "names": {
      "zh": "丁璿",
      "vi": "Đinh Toàn"
    },
    "aliases": {
      "zh": [
        "璿"
      ],
      "vi": [
        "Vệ Vương Toàn"
      ]
    }
  },
  {
    "id": "person:dinh-dien",
    "type": "person",
    "names": {
      "zh": "丁佃",
      "vi": "Đinh Điền"
    },
    "aliases": {
      "zh": [],
      "vi": []
    }
  },
  {
    "id": "person:duong-thi",
    "type": "person",
    "names": {
      "zh": "楊氏",
      "vi": "Dương Thị"
    },
    "aliases": {
      "zh": [],
      "vi": []
    }
  },
  {
    "id": "person:ngo-si-lien",
    "type": "person",
    "names": {
      "zh": "吳士連",
      "vi": "Ngô Sĩ Liên"
    },
    "aliases": {
      "zh": [],
      "vi": []
    }
  },
  {
    "id": "person:pham-hap",
    "type": "person",
    "names": {
      "zh": "范盍",
      "vi": "Phạm Hạp"
    },
    "aliases": {
      "zh": [],
      "vi": []
    }
  },
  {
    "id": "person:pham-cu-lang",
    "type": "person",
    "names": {
      "zh": "范巨倆",
      "vi": "Phạm Cự Lạng"
    },
    "aliases": {
      "zh": [],
      "vi": []
    }
  },
  {
    "id": "person:hau-nhan-bao",
    "type": "person",
    "names": {
      "zh": "侯仁寶",
      "vi": "Hầu Nhân Bảo"
    },
    "aliases": {
      "zh": [],
      "vi": []
    }
  },
  {
    "id": "person:lu-da-ton",
    "type": "person",
    "names": {
      "zh": "盧多遜",
      "vi": "Lư Đa Tốn"
    },
    "aliases": {
      "zh": [],
      "vi": []
    }
  },
  {
    "id": "person:ton-toan-hung",
    "type": "person",
    "names": {
      "zh": "孫全興",
      "vi": "Tôn Toàn Hưng"
    },
    "aliases": {
      "zh": [],
      "vi": []
    }
  },
  {
    "id": "person:hao-thu-tuan",
    "type": "person",
    "names": {
      "zh": "郝守俊",
      "vi": "Hác Thủ Tuấn"
    },
    "aliases": {
      "zh": [],
      "vi": []
    }
  },
  {
    "id": "person:tran-kham-to",
    "type": "person",
    "names": {
      "zh": "陳欽祚",
      "vi": "Trần Khâm Tộ"
    },
    "aliases": {
      "zh": [],
      "vi": []
    },
    "variants": [
      {
        "lang": "vi",
        "surface": "Tràn Khâm Tộ",
        "kind": "suspected_textual_error",
        "status": "review",
        "evidence": "Vietnamese source surface; canonical Vietnamese name retained as Trần Khâm Tộ."
      }
    ]
  },
  {
    "id": "person:thoi-luong",
    "type": "person",
    "names": {
      "zh": "崔亮",
      "vi": "Thôi Lượng"
    },
    "aliases": {
      "zh": [],
      "vi": []
    }
  },
  {
    "id": "person:luu-trung",
    "type": "person",
    "names": {
      "zh": "劉澄",
      "vi": "Lưu Trừng"
    },
    "aliases": {
      "zh": [],
      "vi": []
    }
  },
  {
    "id": "person:gia-thuc",
    "type": "person",
    "names": {
      "zh": "賈湜",
      "vi": "Giả Thực"
    },
    "aliases": {
      "zh": [],
      "vi": []
    }
  },
  {
    "id": "person:vuong-toan",
    "type": "person",
    "names": {
      "zh": "王僎",
      "vi": "Vương Soạn"
    },
    "aliases": {
      "zh": [],
      "vi": []
    }
  },
  {
    "id": "place:hoa-lu",
    "type": "place",
    "names": {
      "zh": "華閭",
      "vi": "Hoa Lư"
    },
    "aliases": {
      "zh": [],
      "vi": []
    },
    "subtype": "cave/capital"
  },
  {